 Intervention Name                  , Description                                                                                        , Approximate Impact on Mortality Rates  , Approximate Per Capita Cost ,Lower Mortality Rate Impact,Higher Mortality Rate Impact,Lower Cost Per Capita,Higher Cost Per Capita,unit
Wellness Programs,"Programs focusing on physical fitness, nutrition, and stress management.",2-5% reduction in overall mortality,Č90-Č345 per year,2,5,90,345,year
Fitness Tracking Incentives,Provide rewards for policyholders using fitness trackers to monitor and improve physical activity.,3-6% reduction in mortality,Č35-Č175 per tracker,3,6,35,175,tracker
Smoking Cessation Programs,Resources and support for policyholders looking to quit smoking.,Up to 50% reduction in mortality,"Č870-Č3,485 per participant",0,50,0,870,participant
Annual Health Check-ups,Encourage regular health check-ups with discounts for compliance.,5-10% reduction in mortality,Č175-Č870 per check-up,5,10,175,870,check-up
Telemedicine Services,Provide access to virtual healthcare services for convenience and timely medical advice.,3-5% reduction in mortality,Č50-Č175 per consultation,3,5,50,175,consultation
Healthy Eating Campaigns,Promote healthy eating habits through educational campaigns and incentives.,2-4% reduction in mortality,Č10-Č35 per participant,2,4,10,35,participant
Weight Management Programs,Support weight loss and maintenance through diet and exercise programs.,5-10% reduction in mortality,Č175-Č870 per program,5,10,175,870,program
Mental Health Support,Provide access to mental health resources and counseling services.,3-8% reduction in mortality,Č90-Č345 per counseling session,3,8,90,345,counseling session
Financial Planning Assistance,Help policyholders with financial planning to reduce stress related to economic concerns.,2-4% reduction in mortality,Č90-Č345 per session,2,4,90,345,session
Educational Workshops,"Conduct workshops on healthy living, disease prevention, and general well-being.",2-4% reduction in overall mortality,Č20-Č85 per workshop,2,4,20,85,workshop
Incentives for Vaccinations,Encourage policyholders to stay up-to-date with vaccinations by offering incentives.,2-8% reduction in mortality,Č20-Č85 per incentive,2,8,20,85,incentive
Regular Dental Check-ups,Stress the importance of oral health and offer discounts for regular dental check-ups.,2-4% reduction in mortality,Č90-Č345 per check-up,2,4,90,345,check-up
Vision Care Programs,Promote eye health and provide discounts for vision screenings and eyeglasses.,2-3% reduction in mortality,Č90-Č345 per participant,2,3,90,345,participant
Safety Campaigns,Educate policyholders on safety measures at home and in daily activities.,3-5% reduction in mortality,Č10-Č35 per participant,3,5,10,35,participant
Driving Safety Courses,Offer discounts for policyholders who complete defensive driving courses.,2-4% reduction in mortality,Č85-Č175 per course,2,4,85,175,course
Heart Health Screenings,Encourage regular screenings for cholesterol levels and blood pressure.,5-10% reduction in mortality,Č90-Č345 per screening,5,10,90,345,screening
Chronic Disease Management,Provide support and resources for policyholders managing chronic conditions.,5-10% reduction in mortality,Č175-Č870 per program,5,10,175,870,program
Sleep Hygiene Programs,Educate on the importance of good sleep hygiene for overall health.,3-5% reduction in mortality,Č20-Č85 per program,3,5,20,85,program
Community Fitness Challenges,Organize community-based fitness challenges with rewards for participation.,2-5% reduction in mortality,Č10-Č35 per participant,2,5,10,35,participant
Discounted Gym Memberships,Partner with fitness centers to offer discounted memberships to policyholders.,3-6% reduction in mortality,Č175-Č870 per membership,3,6,175,870,membership
Online Health Resources,Provide access to online health resources for information and support.,2-4% reduction in mortality,Č10-Č35 per participant,2,4,10,35,participant
Personalized Health Plans,Offer personalized health plans based on individual risk factors and goals.,3-6% reduction in mortality,Č90-Č345 per plan,3,6,90,345,plan
Well-being Apps,Recommend and support the use of apps focused on mental and physical well-being.,2-4% reduction in mortality,Č10-Č35 per app,2,4,10,35,app
Hydration Campaigns,Promote the importance of staying hydrated for overall health.,2-3% reduction in mortality,Č10-Č35 per campaign,2,3,10,35,campaign
Sun Safety Awareness,Educate on sun safety to prevent skin cancer and other related conditions.,2-4% reduction in mortality,Č10-Č35 per campaign,2,4,10,35,campaign
Emergency Preparedness Training,Provide resources and training for emergency preparedness.,2-4% reduction in mortality,Č20-Č85 per trainining session,2,4,20,85,trainining session
Social Connection Initiatives,Encourage social activities to foster a sense of community and reduce isolation.,3-5% reduction in mortality,Č10-Č35 per social event,3,5,10,35,social event
Holistic Stress Reduction,"Promote holistic approaches to stress reduction, such as yoga and meditation.",3-8% reduction in mortality,Č20-Č85 per session,3,8,20,85,session
Financial Incentives for Healthy Behavior,Offer premium discounts or cash rewards for maintaining healthy behaviors.,2-5% reduction in mortality,Č20-Č85 per incentive,2,5,20,85,incentive
Genetic Testing,Provide information on genetic testing for hereditary health risks.,2-4% reduction in mortality,Č90-Č345 per test,2,4,90,345,test
Alcohol Moderation Programs,Offer resources and support for policyholders looking to moderate alcohol consumption.,3-6% reduction in mortality,Č90-Č345 per program,3,6,90,345,program
Environmental Wellness,Promote awareness of environmental factors affecting health and well-being.,2-4% reduction in mortality,Č10-Č35 per campaign,2,4,10,35,campaign
Employee Assistance Programs,Extend support services to family members of policyholders through workplace programs.,3-5% reduction in mortality,Č90-Č345 per counseling session,3,5,90,345,counseling session
Holistic Nutrition Education,Provide education on the benefits of a balanced and holistic approach to nutrition.,2-4% reduction in mortality,Č20-Č85 per session,2,4,20,85,session
Incentives for Preventive Screenings,Offer rewards for policyholders who undergo preventive health screenings.,5-10% reduction in mortality,Č20-Č85 per incentive,5,10,20,85,incentive
Holistic Health Assessments,"Conduct holistic health assessments to address physical, mental, and emotional well-being.",3-6% reduction in mortality,Č90-Č345 per assessment,3,6,90,345,assessment
Cancer Prevention Initiatives,Provide resources and information on cancer prevention strategies.,5-10% reduction through early detection,Č20-Č85 per initiative,5,10,20,85,initiative
Community Gardens,Support community gardens to promote access to fresh and healthy foods.,2-4% reduction in mortality,Č10-Č35 per garden plot,2,4,10,35,garden plot
Active Aging Programs,Encourage activities that promote active aging for elderly policyholders.,3-6% reduction in mortality,Č20-Č85 per program,3,6,20,85,program
Home Safety Inspections,Offer resources for home safety inspections to prevent accidents.,3-5% reduction in mortality,Č20-Č85 per inspection,3,5,20,85,inspection
Mindfulness Programs,Introduce mindfulness and stress reduction programs.,3-8% reduction in mortality,Č20-Č85 per session,3,8,20,85,session
Parenting Support Services,Provide resources and support for parents to promote family well-being.,2-4% reduction in mortality,Č10-Č35 per session,2,4,10,35,session
Travel Safety Tips,Educate policyholders on travel safety to reduce risks during trips.,2-4% reduction in mortality,Č10-Č35 per campaign,2,4,10,35,campaign
Financial Literacy Workshops,Conduct workshops on financial literacy to reduce stress related to money management.,2-4% reduction in mortality,Č20-Č85 per workshop,2,4,20,85,workshop
Hiking and Outdoor Activities Groups,Facilitate outdoor activities groups to promote physical activity.,3-6% reduction in mortality,Č20-Č85 per group,3,6,20,85,group
Cognitive Health Programs,Offer resources and activities to support cognitive health.,3-6% reduction in mortality,Č20-Č85 per program,3,6,20,85,program
Art and Creativity Classes,Promote engagement in artistic and creative pursuits for mental well-being.,2-4% reduction in mortality,Č10-Č35 per class,2,4,10,35,class
Mind-Body Wellness Retreats,Organize wellness retreats focusing on mind-body balance.,3-6% reduction in mortality,Č90-Č345 per retreat,3,6,90,345,retreat
Incentives for Regular Medication Adherence,Offer rewards for policyholders who consistently adhere to prescribed medications.,2-5% reduction in mortality,Č20-Č85 per incentive,2,5,20,85,incentive
Ergonomic Workstation Assessments,Conduct ergonomic workstation assessments to address workplace ergonomics.,2-4% reduction in mortality,Č20-Č85 per assessment,2,4,20,85,assessment
